{
  "$schema": "https://json-schema.org/draft/2020-12/schema",
  "$id": "https://hummbl.dev/schemas/security/agent-vulnerability/v1.0.0/agent-vulnerability.schema.json",
  "title": "Agentic Vulnerability Record (AVR)",
  "description": "The CVE-style unit for agentic AI: a vulnerability record whose 'affected' set can express not just package version ranges (component mode, interoperable with CVE/GHSA/AVE/OSV-style advisories) but resolved agent CONFIGURATIONS (configuration mode) -- predicates over an agent-lock document's harness, model, goal, tools, permissions, and policy. Registry feeds are JSONL: one AVR per line. A lockfile is affected if ANY affected entry matches. A 'configuration' entry matches if its config_sha256 list contains the lockfile's provenance.config_sha256, or ALL 'require' predicates evaluate true (paths are dot-paths over the lockfile; [name=X] / [kind=Y] select array elements; ops: eq, ne, lt, lte, gt, gte, in, exists, pattern, contains). 'window' bounds matching by lockfile generated_at, since hosted-model identity drifts over time.",
  "type": "object",
  "required": ["schema_version", "id", "status", "published", "modified", "summary", "affected"],
  "additionalProperties": false,
  "properties": {
    "schema_version": {
      "const": "avr/1.0.0",
      "description": "Record format version"
    },
    "id": {
      "type": "string",
      "pattern": "^ACVE-\\d{4}-\\d{4,}$",
      "description": "Registry identifier, e.g. ACVE-2026-00001. 'CVE-' is MITRE's namespace and must not be squatted; CVE/GHSA/AVE cross-references go in 'aliases'."
    },
    "status": {
      "type": "string",
      "enum": ["draft", "published", "rejected", "withdrawn"],
      "description": "Record lifecycle state"
    },
    "published": {
      "type": "string",
      "format": "date-time",
      "pattern": "^\\d{4}-\\d{2}-\\d{2}T\\d{2}:\\d{2}:\\d{2}(\\.\\d+)?(Z|[+-]\\d{2}:\\d{2})$",
      "description": "RFC 3339 publication timestamp"
    },
    "modified": {
      "type": "string",
      "format": "date-time",
      "pattern": "^\\d{4}-\\d{2}-\\d{2}T\\d{2}:\\d{2}:\\d{2}(\\.\\d+)?(Z|[+-]\\d{2}:\\d{2})$",
      "description": "RFC 3339 last-modified timestamp"
    },
    "summary": {
      "type": "string",
      "minLength": 10,
      "maxLength": 500,
      "description": "One-line description of the vulnerability"
    },
    "details": {
      "type": "string",
      "description": "Long-form description, markdown permitted"
    },
    "aliases": {
      "type": "array",
      "items": { "type": "string" },
      "description": "Cross-registry identifiers: CVE-*, GHSA-*, AVE-*, or other ACVE-* IDs"
    },
    "related": {
      "type": "array",
      "items": { "type": "string" },
      "description": "Related-but-not-identical record IDs"
    },
    "affected": {
      "type": "array",
      "minItems": 1,
      "description": "What this vulnerability affects. Each entry is EITHER a component entry (versioned artifact, CVE-style) OR a configuration entry (predicate over an agent-lock unit).",
      "items": {
        "oneOf": [
          {
            "type": "object",
            "required": ["unit", "component"],
            "additionalProperties": false,
            "properties": {
              "unit": {
                "const": "component",
                "description": "Component mode: the vulnerable thing is a versioned artifact"
              },
              "component": {
                "type": "object",
                "required": ["kind", "name"],
                "additionalProperties": false,
                "properties": {
                  "kind": {
                    "type": "string",
                    "enum": ["harness", "model", "tool", "skill", "prompt", "policy", "protocol", "package"],
                    "description": "Component class"
                  },
                  "name": {
                    "type": "string",
                    "minLength": 1,
                    "description": "Component name matching the lockfile field for that kind"
                  },
                  "purl": {
                    "type": "string",
                    "description": "Package URL for precise package identity"
                  },
                  "ranges": {
                    "type": "array",
                    "description": "Affected version ranges (OSV-style)",
                    "items": {
                      "type": "object",
                      "required": ["type", "events"],
                      "additionalProperties": false,
                      "properties": {
                        "type": {
                          "type": "string",
                          "enum": ["SEMVER", "DATE", "GIT"],
                          "description": "Range semantics: SEMVER for versioned packages, DATE for hosted models/snapshots, GIT for commit revisions"
                        },
                        "events": {
                          "type": "array",
                          "minItems": 1,
                          "items": {
                            "type": "object",
                            "additionalProperties": false,
                            "properties": {
                              "introduced": { "type": "string", "description": "First affected version/date/commit ('0' = always)" },
                              "fixed": { "type": "string", "description": "First fixed version/date/commit" },
                              "last_affected": { "type": "string" },
                              "limit": { "type": "string", "description": "Upper bound, exclusive, no fix implied" }
                            }
                          }
                        }
                      }
                    }
                  },
                  "versions": {
                    "type": "array",
                    "items": { "type": "string" },
                    "description": "Explicitly enumerated affected versions"
                  }
                }
              }
            }
          },
          {
            "type": "object",
            "required": ["unit", "configuration"],
            "additionalProperties": false,
            "properties": {
              "unit": {
                "const": "configuration",
                "description": "Configuration mode: the vulnerable thing is a resolved combination, not any single component"
              },
              "configuration": {
                "type": "object",
                "additionalProperties": false,
                "properties": {
                  "config_sha256": {
                    "type": "array",
                    "items": {
                      "type": "string",
                      "pattern": "^[0-9a-f]{64}$"
                    },
                    "description": "Exact-match fast path: lockfiles whose provenance.config_sha256 is in this list are affected"
                  },
                  "require": {
                    "type": "array",
                    "minItems": 1,
                    "description": "All predicates must hold for a lockfile to match",
                    "items": {
                      "type": "object",
                      "required": ["path", "op"],
                      "additionalProperties": false,
                      "properties": {
                        "path": {
                          "type": "string",
                          "minLength": 1,
                          "description": "Dot-path into the lockfile. Examples: 'model.pin', 'model.provider', 'agent.goal.class', 'harness.name', 'policy.version', 'tools[kind=exec].permissions.exec.allowed', 'tools[name=write_file].permissions.fs_write', 'tools[].purl'"
                        },
                        "op": {
                          "type": "string",
                          "enum": ["eq", "ne", "lt", "lte", "gt", "gte", "in", "exists", "pattern", "contains"],
                          "description": "eq/ne = equality; lt/lte/gt/gte = ordered comparison (semver-aware on *.version fields); in = value list membership; exists = field present (omit value or value:true; set value:false to require absence); pattern = regex; contains = array/element membership"
                        },
                        "value": {
                          "description": "Comparison operand. For 'in' an array; for 'pattern' a regex string; for semver comparisons a version string; for 'exists' an optional boolean (false = require absence)."
                        }
                      }
                    }
                  },
                  "window": {
                    "type": "object",
                    "additionalProperties": false,
                    "description": "Temporal bounds matched against lockfile generated_at -- required because hosted model/alias identity drifts",
                    "properties": {
                      "introduced_at": { "type": "string", "format": "date-time", "minLength": 1 },
                      "fixed_at": { "type": "string", "format": "date-time", "minLength": 1 },
                      "last_affected_at": { "type": "string", "format": "date-time", "minLength": 1 }
                    }
                  }
                }
              }
            }
          }
        ]
      }
    },
    "attack_class": {
      "type": "object",
      "description": "Attack taxonomy mapping",
      "required": ["primary"],
      "additionalProperties": false,
      "properties": {
        "primary": {
          "type": "string",
          "enum": [
            "prompt-injection",
            "tool-poisoning",
            "goal-hijack",
            "tool-escape",
            "credential-exfiltration",
            "cross-agent-contamination",
            "supply-chain",
            "model-drift",
            "over-permission",
            "data-poisoning",
            "insecure-default",
            "denial-of-service",
            "other"
          ]
        },
        "owasp_asi": {
          "type": "array",
          "items": { "type": "string" },
          "description": "OWASP Agentic Security Initiative category IDs, e.g. 'ASI01'"
        },
        "owasp_mcp": {
          "type": "array",
          "items": { "type": "string" },
          "description": "OWASP MCP Top 10 category IDs, e.g. 'MCP03'. Same anchor AVE records require once active -- enables direct AVE<->AVR crosswalk."
        },
        "mitre_atlas": {
          "type": "array",
          "items": { "type": "string" },
          "description": "MITRE ATLAS technique IDs, e.g. 'AML.T0051'"
        },
        "cwe": {
          "type": "array",
          "items": {
            "type": "string",
            "pattern": "^CWE-\\d+$"
          },
          "description": "Applicable CWE identifiers for the underlying weakness class"
        }
      }
    },
    "severity": {
      "type": "array",
      "description": "One or more severity assessments; different systems may coexist",
      "items": {
        "type": "object",
        "required": ["type", "score"],
        "additionalProperties": false,
        "properties": {
          "type": {
            "type": "string",
            "enum": ["CVSS_V3", "CVSS_V4", "AIVSS", "QUALITATIVE"],
            "description": "Scoring system. AIVSS = agentic extension covering tool access and human-oversight scope; QUALITATIVE = critical|high|medium|low."
          },
          "score": {
            "type": "string",
            "minLength": 1,
            "description": "Score value/vector string, e.g. 'CVSS:4.0/AV:N/AC:L/...' or 'high'"
          }
        }
      }
    },
    "preconditions": {
      "type": "array",
      "items": { "type": "string" },
      "description": "Conditions that must hold for exploitation beyond the affected match (e.g. 'attacker-controlled content reaches a tool input')"
    },
    "evidence": {
      "type": "object",
      "additionalProperties": false,
      "description": "Reproduction and verification material",
      "properties": {
        "reproduction": { "type": "string", "description": "How to reproduce/observe the vulnerability" },
        "eval_ref": { "type": "string", "description": "Reference to an eval/fixture demonstrating the issue" },
        "lockfile_sha256": {
          "type": "string",
          "pattern": "^[0-9a-f]{64}$",
          "description": "config_sha256 of a lockfile that was observed vulnerable"
        }
      }
    },
    "references": {
      "type": "array",
      "items": {
        "type": "object",
        "required": ["type", "url"],
        "additionalProperties": false,
        "properties": {
          "type": {
            "type": "string",
            "enum": ["advisory", "fix", "report", "article", "package", "evidence", "detection"]
          },
          "url": { "type": "string" }
        }
      }
    },
    "credits": {
      "type": "array",
      "items": {
        "type": "object",
        "required": ["name"],
        "additionalProperties": false,
        "properties": {
          "name": { "type": "string" },
          "contact": { "type": "string" }
        }
      }
    },
    "database_specific": {
      "type": "object",
      "description": "Registry-specific extensions (mirrors OSV's database_specific convention)",
      "additionalProperties": true
    }
  }
}
