{
  "schema_version": "avr/1.0.0",
  "id": "ACVE-2026-00001",
  "status": "published",
  "published": "2026-09-21T00:00:00Z",
  "modified": "2026-09-21T00:00:00Z",
  "summary": "MCP tools without schema pinning are exposed to silent tool-description mutation (rug pull / tool poisoning)",
  "details": "MCP clients inject connected servers' tool descriptions into the model context at enumeration time. A server can mutate a tool's description after the user's initial approval -- the 'MCP rug pull' -- inserting hidden instructions the user never reviewed. When a deployment has MCP tools but no schema_sha256 pin recorded for them, there is no integrity anchor to detect the mutation. The affected unit is the configuration (unpinned MCP tool surface), not any single package version: any MCP server can exhibit this behavior, and the client-side gap is the missing pin. Detection/mitigation exists via tool pinning (hashing descriptions across sessions), e.g. mcp-scan.",
  "affected": [
    {
      "unit": "configuration",
      "configuration": {
        "require": [
          { "path": "tools[kind=mcp]", "op": "exists", "value": true },
          { "path": "tools[kind=mcp].schema_sha256", "op": "exists", "value": false }
        ],
        "window": { "introduced_at": "2024-11-25T00:00:00Z" }
      }
    }
  ],
  "attack_class": {
    "primary": "tool-poisoning",
    "mitre_atlas": ["AML.T0051"],
    "cwe": ["CWE-829"]
  },
  "severity": [
    { "type": "QUALITATIVE", "score": "high" }
  ],
  "preconditions": [
    "an MCP server modifies a tool description after initial enumeration/approval",
    "the agent reads and acts on tool descriptions"
  ],
  "evidence": {
    "reproduction": "Change a connected MCP server's tool description to include injected instructions; the agent consumes the new text on next enumeration with no integrity alert."
  },
  "references": [
    { "type": "report", "url": "https://invariantlabs.ai/blog/mcp-security-notification-tool-poisoning-attacks" },
    { "type": "detection", "url": "https://invariantlabs-ai.github.io/docs/mcp-scan/" }
  ],
  "credits": [
    { "name": "Invariant Labs", "contact": "https://invariantlabs.ai" }
  ],
  "database_specific": {
    "registry": "acve",
    "note": "Seed record. Documents a publicly disclosed vulnerability class (Invariant Labs, 2025-04); listed for format demonstration and real matching coverage of unpinned MCP surfaces."
  }
}
